{
  "id": "620954f5-54b2-4b02-88b0-f6e4165cb6d3",
  "schema_version": 1.0,
  "reference": 6000308,
  "application_type": "initial",
  "means_passport": ["on_benefit_check"],
  "submitted_at": "2022-10-24T09:50:04.019Z",
  "date_stamp": "2022-10-24T09:50:04.019Z",
  "declaration_signed_at": "2022-10-24T09:50:04.019Z",
  "provider_details": {
    "office_code": "0Z981E",
    "provider_email": "abenn@quinn-melville.co.uk",
    "legal_rep_first_name": "Karl",
    "legal_rep_last_name": "Kent",
    "legal_rep_telephone": "07712345678"
  },
  "client_details": {
    "applicant": {
      "date_of_birth": "1980-01-10",
      "nino": "JA293483A",
      "benefit_type": "universal_credit",
      "telephone_number": "",
      "correspondence_address_type": "providers_office_address",
      "last_name": "Walker",
      "first_name": "Pat",
      "other_names": ""
    }
  },
  "case_details": {
    "urn": "",
    "case_type": "summary_only",
    "offence_class": "H",
    "hearing_court_name": "Cardiff Magistrates' Court",
    "hearing_date": "2024-09-27"
  },
  "means_details": {
    "income_details": {
      "benefits": [
        {
          "type": "child",
          "amount": 200,
          "frequency": "month",
          "details": "Details about child benefit"
        },
        {
          "type": "incapacity",
          "amount": 300,
          "frequency": "fortnight",
          "details": null
        },
        {
          "type": "universal_credit",
          "amount": 500,
          "frequency": "week",
          "details": null
        }
      ],
      "employment_type": ["not_working"],
      "other_income": [
        {
          "type": "private_pension",
          "amount": 13000,
          "frequency": "annual",
          "details": "Details about private pension"
        },
        {
          "type": "interest",
          "amount": 700,
          "frequency": "four_weeks",
          "details": null
        },
        {
          "type": "rent",
          "amount": 635,
          "frequency": "month",
          "details": null
        }
      ],
      "dependants": [
        {
          "age": 8
        },
        {
          "age": 9
        },
        {
          "age": 17
        }
      ]
    }
  },
  "ioj_bypass": true
}
